# UC1 Create DataBase addressbookSQL_service

mysql> show databases;
+--------------------------+
| Database                 |
+--------------------------+
| employee_payroll_service |
| information_schema       |
| mysql                    |
| payroll_service          |
| payrollservice           |
| performance_schema       |
| sakila                   |
| sys                      |
| world                    |
+--------------------------+
9 rows in set (0.00 sec)

mysql> create database addressbookSQL_service;
Query OK, 1 row affected (0.01 sec)

mysql> show databases;
+--------------------------+
| Database                 |
+--------------------------+
| addressbooksql_service   |
| employee_payroll_service |
| information_schema       |
| mysql                    |
| payroll_service          |
| payrollservice           |
| performance_schema       |
| sakila                   |
| sys                      |
| world                    |
+--------------------------+
10 rows in set (0.01 sec)

mysql> use addressbookSQL_service;
Database changed

#UC2: Create table Address_Book 

mysql> select database()
    -> ;
+------------------------+
| database()             |
+------------------------+
| addressbooksql_service |
+------------------------+
1 row in set (0.00 sec)

mysql> create table address_book (
    -> firstname VARCHAR(100) NOT NULL,
    -> lastname VARCHAR(100) NOT NULL,
    -> address VARCHAR(150),
    -> city VARCHAR(50),
    -> state VARCHAR(50),
    -> zip int unsigned,
    -> phone int unsigned NOT NULL,
    -> email VARCHAR(50)
    -> );
Query OK, 0 rows affected (0.06 sec)

mysql> describe address_book;
+-----------+--------------+------+-----+---------+-------+
| Field     | Type         | Null | Key | Default | Extra |
+-----------+--------------+------+-----+---------+-------+
| firstname | varchar(100) | NO   |     | NULL    |       |
| lastname  | varchar(100) | NO   |     | NULL    |       |
| address   | varchar(150) | YES  |     | NULL    |       |
| city      | varchar(50)  | YES  |     | NULL    |       |
| state     | varchar(50)  | YES  |     | NULL    |       |
| zip       | int unsigned | YES  |     | NULL    |       |
| phone     | int unsigned | NO   |     | NULL    |       |
| email     | varchar(50)  | YES  |     | NULL    |       |
+-----------+--------------+------+-----+---------+-------+
8 rows in set (0.01 sec)

UC3: Ability to add Contacts into Address_Book

mysql> INSERT INTO address_book VALUES
    -> ('Murali', 'saravanan', 'nagar', 'trichy', 'tamilnadu', 620019, 945883, 'murali@abc.com'),
    -> ('Priya', 'hello', 'nagar', 'mumbai', 'maharashtra', 400076, 983765, 'priya@abc.com');
Query OK, 2 rows affected (0.01 sec)
Records: 2  Duplicates: 0  Warnings: 0

mysql> SELECT * from address_book;
+-----------+-----------+---------+--------+-------------+--------+--------+----------------+
| firstname | lastname  | address | city   | state       | zip    | phone  | email          |
+-----------+-----------+---------+--------+-------------+--------+--------+----------------+
| Murali    | saravanan | nagar   | trichy | tamilnadu   | 620019 | 945883 | murali@abc.com |
| Priya     | hello     | nagar   | mumbai | maharashtra | 400076 | 983765 | priya@abc.com  |
+-----------+-----------+---------+--------+-------------+--------+--------+----------------+
2 rows in set (0.00 sec)

#UC4 Edit data in table Address_book

mysql> update address_book set address = 'firstcross' where firstname = 'Murali';
Query OK, 1 row affected (0.01 sec)
Rows matched: 1  Changed: 1  Warnings: 0

mysql> select * from address_book;
+-----------+-----------+------------+--------+-------------+--------+--------+----------------+
| firstname | lastname  | address    | city   | state       | zip    | phone  | email          |
+-----------+-----------+------------+--------+-------------+--------+--------+----------------+
| Murali    | saravanan | firstcross | trichy | tamilnadu   | 620019 | 945883 | murali@abc.com |
| Priya     | hello     | nagar      | mumbai | maharashtra | 400076 | 983765 | priya@abc.com  |
+-----------+-----------+------------+--------+-------------+--------+--------+----------------+
2 rows in set (0.01 sec)