# UC1 Create DataBase addressbookSQL_service

mysql> show databases;
+--------------------------+
| Database                 |
+--------------------------+
| employee_payroll_service |
| information_schema       |
| mysql                    |
| payroll_service          |
| payrollservice           |
| performance_schema       |
| sakila                   |
| sys                      |
| world                    |
+--------------------------+
9 rows in set (0.00 sec)

mysql> create database addressbookSQL_service;
Query OK, 1 row affected (0.01 sec)

mysql> show databases;
+--------------------------+
| Database                 |
+--------------------------+
| addressbooksql_service   |
| employee_payroll_service |
| information_schema       |
| mysql                    |
| payroll_service          |
| payrollservice           |
| performance_schema       |
| sakila                   |
| sys                      |
| world                    |
+--------------------------+
10 rows in set (0.01 sec)

mysql> use addressbookSQL_service;
Database changed

#UC2: Create table Address_Book 

mysql> select database()
    -> ;
+------------------------+
| database()             |
+------------------------+
| addressbooksql_service |
+------------------------+
1 row in set (0.00 sec)

mysql> create table address_book (
    -> firstname VARCHAR(100) NOT NULL,
    -> lastname VARCHAR(100) NOT NULL,
    -> address VARCHAR(150),
    -> city VARCHAR(50),
    -> state VARCHAR(50),
    -> zip int unsigned,
    -> phone int unsigned NOT NULL,
    -> email VARCHAR(50)
    -> );
Query OK, 0 rows affected (0.06 sec)

mysql> describe address_book;
+-----------+--------------+------+-----+---------+-------+
| Field     | Type         | Null | Key | Default | Extra |
+-----------+--------------+------+-----+---------+-------+
| firstname | varchar(100) | NO   |     | NULL    |       |
| lastname  | varchar(100) | NO   |     | NULL    |       |
| address   | varchar(150) | YES  |     | NULL    |       |
| city      | varchar(50)  | YES  |     | NULL    |       |
| state     | varchar(50)  | YES  |     | NULL    |       |
| zip       | int unsigned | YES  |     | NULL    |       |
| phone     | int unsigned | NO   |     | NULL    |       |
| email     | varchar(50)  | YES  |     | NULL    |       |
+-----------+--------------+------+-----+---------+-------+
8 rows in set (0.01 sec)

UC3: Ability to add Contacts into Address_Book

mysql> INSERT INTO address_book VALUES
    -> ('Murali', 'saravanan', 'nagar', 'trichy', 'tamilnadu', 620019, 945883, 'murali@abc.com'),
    -> ('Priya', 'hello', 'nagar', 'mumbai', 'maharashtra', 400076, 983765, 'priya@abc.com');
Query OK, 2 rows affected (0.01 sec)
Records: 2  Duplicates: 0  Warnings: 0

mysql> SELECT * from address_book;
+-----------+-----------+---------+--------+-------------+--------+--------+----------------+
| firstname | lastname  | address | city   | state       | zip    | phone  | email          |
+-----------+-----------+---------+--------+-------------+--------+--------+----------------+
| Murali    | saravanan | nagar   | trichy | tamilnadu   | 620019 | 945883 | murali@abc.com |
| Priya     | hello     | nagar   | mumbai | maharashtra | 400076 | 983765 | priya@abc.com  |
+-----------+-----------+---------+--------+-------------+--------+--------+----------------+
2 rows in set (0.00 sec)

#UC4 Edit data in table Address_book

mysql> update address_book set address = 'firstcross' where firstname = 'Murali';
Query OK, 1 row affected (0.01 sec)
Rows matched: 1  Changed: 1  Warnings: 0

mysql> select * from address_book;
+-----------+-----------+------------+--------+-------------+--------+--------+----------------+
| firstname | lastname  | address    | city   | state       | zip    | phone  | email          |
+-----------+-----------+------------+--------+-------------+--------+--------+----------------+
| Murali    | saravanan | firstcross | trichy | tamilnadu   | 620019 | 945883 | murali@abc.com |
| Priya     | hello     | nagar      | mumbai | maharashtra | 400076 | 983765 | priya@abc.com  |
+-----------+-----------+------------+--------+-------------+--------+--------+----------------+
2 rows in set (0.01 sec)

#UC5 Delete record using person's name from table

mysql> DELETE from address_book where firstname = 'Priya';
Query OK, 1 row affected (0.01 sec)

mysql> select * from address_book;
+-----------+-----------+------------+--------+-----------+--------+--------+----------------+
| firstname | lastname  | address    | city   | state     | zip    | phone  | email          |
+-----------+-----------+------------+--------+-----------+--------+--------+----------------+
| Murali    | saravanan | firstcross | trichy | tamilnadu | 620019 | 945883 | murali@abc.com |
+-----------+-----------+------------+--------+-----------+--------+--------+----------------+
1 row in set (0.00 sec)

#UC6 Retrive data from table address_book

mysql> INSERT INTO address_book VALUES
    -> ('Priya', 'hello', 'nagar', 'mumbai', 'maharashtra', 400076, 98321, 'priya@abc.com'),
    -> ('Viknesh', 'welcome', 'nagar', 'trichy', 'tamilnadu', 620018, 98299, 'vicky@abc.com');
Query OK, 2 rows affected (0.01 sec)
Records: 2  Duplicates: 0  Warnings: 0

mysql> select * from address_book;
+-----------+-----------+------------+--------+-------------+--------+--------+----------------+
| firstname | lastname  | address    | city   | state       | zip    | phone  | email          |
+-----------+-----------+------------+--------+-------------+--------+--------+----------------+
| Murali    | saravanan | firstcross | trichy | tamilnadu   | 620019 | 945883 | murali@abc.com |
| Priya     | hello     | nagar      | mumbai | maharashtra | 400076 |  98321 | priya@abc.com  |
| Viknesh   | welcome   | nagar      | trichy | tamilnadu   | 620018 |  98299 | vicky@abc.com  |
+-----------+-----------+------------+--------+-------------+--------+--------+----------------+
3 rows in set (0.01 sec)

mysql> SELECT * from address_book where city = 'trichy';
+-----------+-----------+------------+--------+-----------+--------+--------+----------------+
| firstname | lastname  | address    | city   | state     | zip    | phone  | email          |
+-----------+-----------+------------+--------+-----------+--------+--------+----------------+
| Murali    | saravanan | firstcross | trichy | tamilnadu | 620019 | 945883 | murali@abc.com |
| Viknesh   | welcome   | nagar      | trichy | tamilnadu | 620018 |  98299 | vicky@abc.com  |
+-----------+-----------+------------+--------+-----------+--------+--------+----------------+
2 rows in set (0.00 sec)

#UC7 COUNT the size of address_book by City and State

mysql> SELECT COUNT(firstname) from address_book WHERE city = 'trichy';
+------------------+
| COUNT(firstname) |
+------------------+
|                2 |
+------------------+
1 row in set (0.01 sec)

mysql> SELECT COUNT(*) from address_book WHERE state = 'maharashtra';
+----------+
| COUNT(*) |
+----------+
|        1 |
+----------+
1 row in set (0.00 sec)

#UC8 Retrieve entries sorted alphabetically by Person’s name from table


mysql> INSERT INTO address_book VALUES
    -> ('John','willow', 'secondcross', 'kolkata', 'kerela', 356987, 9877222, 'john@abc.com'),
    -> ('Rick', 'welx', 'thirdcross', 'bangalore', 'karnataka', 234567, 999888, 'rick@abc.com');
Query OK, 2 rows affected (0.01 sec)
Records: 2  Duplicates: 0  Warnings: 0

mysql> select * from address_book;
+-----------+-----------+-------------+-----------+-------------+--------+---------+----------------+
| firstname | lastname  | address     | city      | state       | zip    | phone   | email          |
+-----------+-----------+-------------+-----------+-------------+--------+---------+----------------+
| Murali    | saravanan | firstcross  | trichy    | tamilnadu   | 620019 |  945883 | murali@abc.com |
| Priya     | hello     | nagar       | mumbai    | maharashtra | 400076 |   98321 | priya@abc.com  |
| Viknesh   | welcome   | nagar       | trichy    | tamilnadu   | 620018 |   98299 | vicky@abc.com  |
| John      | willow    | secondcross | kolkata   | kerela      | 356987 | 9877222 | john@abc.com   |
| Rick      | welx      | thirdcross  | bangalore | karnataka   | 234567 |  999888 | rick@abc.com   |
+-----------+-----------+-------------+-----------+-------------+--------+---------+----------------+
5 rows in set (0.01 sec)

mysql> SELECT * from address_book WHERE state = 'tamilnadu' ORDER BY firstname;
+-----------+-----------+------------+--------+-----------+--------+--------+----------------+
| firstname | lastname  | address    | city   | state     | zip    | phone  | email          |
+-----------+-----------+------------+--------+-----------+--------+--------+----------------+
| Murali    | saravanan | firstcross | trichy | tamilnadu | 620019 | 945883 | murali@abc.com |
| Viknesh   | welcome   | nagar      | trichy | tamilnadu | 620018 |  98299 | vicky@abc.com  |
+-----------+-----------+------------+--------+-----------+--------+--------+----------------+
2 rows in set (0.00 sec)